{
  "format": "ABBO-EDITION-1",
  "kid": "k2026-01",
  "payload": "eyJhdWQiOiJBQkJPLVBST0RVQ1QtVkVSSUZZLVYxIiwiY29kZSI6IlBPU1RFUi1GRVNUSVZBTC1BQkJJQU1PLTIwMjYiLCJjcmVhdGVkQXQiOiIyMDI2LTA3LTI5VDEyOjAwOjAwWiIsImRlc2NyaXB0aW9uIjoiUG9zdGVyIGluIGVkaXppb25lIGxpbWl0YXRhIGRlbCBGZXN0aXZhbCBBQkJJQU1PIC0gMjAyNiAxIEVkaXppb25lIiwiZSI6ImVkX1RNTTlPMWJXUHUwWWpucGxueTRpMFEiLCJpbWFnZSI6eyJhbHQiOiJQb3N0ZXIgdWZmaWNpYWxlIGRlbCBGZXN0aXZhbCBBQkJJQU1PIDIwMjYiLCJwYXRoIjoiL2Fzc2V0cy9wcm9kdWN0cy9lZF9UTU05TzFiV1B1MFlqbnBsbnk0aTBRL2NvdmVyLndlYnAiLCJzaGEyNTYiOiJtUDdpQzk5UWt5eEF1X2FuQVZKb3p1Z1pqaHJfdTVJbGhacmttQ2llREQwIn0sImlzcyI6IkFCQk8gQVBTIiwibiI6MTAwLCJwaHlzaWNhbFNlcmlhbFJlcXVpcmVkIjp0cnVlLCJyIjoxLCJyZWxlYXNlRGF0ZSI6IjIwMjYtMTAtMDQiLCJ0IjoiZWRpdGlvbiIsInRpdGxlIjoiRmVzdGl2YWwgQUJCSUFNTyAyMDI2IiwidiI6MX0",
  "signature": "CVEpP6iWFBn1EbINJaXx1xsnzWE3GHx6X4rCr41E9yRVKm27cY7s2updtu3IgDeFPn7kCDaBKSb0gZtN4GOkKw"
}