{
  "format": "ABBO-EDITION-1",
  "kid": "k2026-01",
  "payload": "eyJhdWQiOiJBQkJPLVBST0RVQ1QtVkVSSUZZLVYxIiwiY29kZSI6IlRFU1QtTkZDLTAwMSIsImNyZWF0ZWRBdCI6IjIwMjYtMDctMjlUMTI6MDA6MDBaIiwiZGVzY3JpcHRpb24iOiJFZGl6aW9uZSB0ZWNuaWNhIGRpIHByb3ZhIE5GQyBBQkJPIEFQUyIsImUiOiJlZF9sTlpyZGdjRXV5LXFGZzk0eFJCUHJBIiwiaW1hZ2UiOnsiYWx0IjoiUG9zdGVyIHV0aWxpenphdG8gcGVyIGlsIHRlc3QgTkZDIEFCQk8gQVBTIiwicGF0aCI6Ii9hc3NldHMvcHJvZHVjdHMvZWRfbE5acmRnY0V1eS1xRmc5NHhSQlByQS9jb3Zlci53ZWJwIiwic2hhMjU2IjoibVA3aUM5OVFreXhBdV9hbkFWSm96dWdaamhyX3U1SWxoWnJrbUNpZUREMCJ9LCJpc3MiOiJBQkJPIEFQUyIsIm4iOjMsInBoeXNpY2FsU2VyaWFsUmVxdWlyZWQiOnRydWUsInIiOjEsInJlbGVhc2VEYXRlIjoiMjAyNi0wOS0xMyIsInQiOiJlZGl0aW9uIiwidGl0bGUiOiJUZXN0IE5GQyBBQkJPIiwidiI6MX0",
  "signature": "owg5P9N_vonQ-wVzuk9JDMMgsABilrCB6ECu1uSfSo-9Jqe9KydTt_w0p2uVdjg90lB8q5kCGNKPNU0gxxy8oQ"
}